{
  "$schema": "https://json-schema.org/draft/2020-12/schema",
  "$id": "https://github.com/Mnesis-Labs/mnesis-canonical/blob/main/embodiments/embodiment.schema.json",
  "title": "Mnesis Embodiment Registry",
  "description": "Schema for embodiment registry entries: one JSON file per embodiment. Authority: Parthenon D-8 / S12. Each file declares the canonical identity, kinematics, asset paths, and teleop defaults for one robot or human embodiment.",
  "type": "object",
  "properties": {
    "id": {
      "type": "string",
      "description": "Embodiment identifier, used as filename stem (e.g. 'airbot_play').",
      "pattern": "^[a-z][a-z0-9_]*$"
    },
    "display_name": {
      "type": "string",
      "description": "Human-readable display name (e.g. 'AIRBOT Play')."
    },
    "arms": {
      "type": "integer",
      "minimum": 1,
      "maximum": 2,
      "description": "Number of arms (1 = single-arm, 2 = dual-arm)."
    },
    "dof_per_arm": {
      "type": "integer",
      "minimum": 0,
      "description": "Number of degrees of freedom per arm, excluding gripper (e.g. 6 for a 6-DOF arm)."
    },
    "joint_names": {
      "type": "array",
      "items": { "type": "string" },
      "minItems": 1,
      "description": "Joint names in order. For dual-arm embodiments, concatenate left then right joints (e.g. [left_j1, ..., left_jN, right_j1, ..., right_jN])."
    },
    "joint_limits": {
      "type": "object",
      "properties": {
        "min": {
          "type": "array",
          "items": { "type": "number" },
          "description": "Minimum joint positions in radians, one per joint_name entry."
        },
        "max": {
          "type": "array",
          "items": { "type": "number" },
          "description": "Maximum joint positions in radians, one per joint_name entry."
        }
      },
      "required": ["min", "max"],
      "description": "Position limits for each joint in radians. Arrays must match joint_names length."
    },
    "gripper_range": {
      "type": "array",
      "items": { "type": "number" },
      "minItems": 2,
      "maxItems": 2,
      "description": "Gripper open/close range, e.g. [0.0, 1.0] (normalized) or [0.0, 0.08] (metres)."
    },
    "base_frame": {
      "type": "string",
      "description": "Base frame name (e.g. 'base', 'chassis', 'pelvis', 'world')."
    },
    "assets": {
      "type": "object",
      "properties": {
        "urdf": { "type": "string", "description": "Path to URDF file, or empty string if not available." },
        "mjcf": { "type": "string", "description": "Path to MuJoCo MJCF file, or empty string if not available." },
        "glb": { "type": "string", "description": "Path to GLB (glTF Binary) file, or empty string if not available." },
        "skeleton": { "type": "string", "description": "Path to skeleton/keypoints file, or empty string if not available." }
      },
      "required": ["urdf", "mjcf", "glb", "skeleton"],
      "description": "Asset paths for rendering, simulation, and skeleton data."
    },
    "teleop": {
      "type": "object",
      "properties": {
        "default_pos_scale": {
          "type": "number",
          "exclusiveMinimum": 0,
          "description": "Default position scaling factor for teleoperation (e.g. 0.3 for fine control)."
        },
        "workspace_box": {
          "type": "array",
          "items": {
            "type": "array",
            "items": { "type": "number" },
            "minItems": 3,
            "maxItems": 3
          },
          "minItems": 2,
          "maxItems": 2,
          "description": "Workspace bounding box [[x_min, y_min, z_min], [x_max, y_max, z_max]] in metres."
        }
      },
      "required": ["default_pos_scale", "workspace_box"],
      "description": "Teleoperation default parameters."
    },
    "capture": {
      "type": "object",
      "description": "Optional (additive, v0.5+) capture-side defaults so a device can be reconfigured by embodiment id instead of hard-coding capture parameters per consumer. Absence = consumer keeps its own defaults.",
      "properties": {
        "default_fps": {
          "type": "number",
          "exclusiveMinimum": 0,
          "description": "Default recording frame rate in frames per second."
        },
        "max_duration_s": {
          "type": "number",
          "exclusiveMinimum": 0,
          "description": "Recommended per-episode duration cap in seconds."
        },
        "cameras": {
          "type": "array",
          "description": "Camera set and resolution for this embodiment's default rig.",
          "items": {
            "type": "object",
            "properties": {
              "name": {
                "type": "string",
                "description": "Camera key (matches observation.images.<cam>, e.g. 'front', 'wrist')."
              },
              "resolution": {
                "type": "array",
                "items": { "type": "integer", "minimum": 1 },
                "minItems": 2,
                "maxItems": 2,
                "description": "Capture resolution [width, height] in pixels."
              },
              "fps": {
                "type": "number",
                "exclusiveMinimum": 0,
                "description": "Per-camera frame rate if it differs from default_fps (optional)."
              },
              "intrinsics": {
                "type": "object",
                "description": "Camera intrinsic parameters and distortion model (C9, v1, additive). Optional: embodiment entries without intrinsics remain valid. When present, model is required — a coefficient vector without a model name is ambiguous.",
                "properties": {
                  "model": {
                    "type": "string",
                    "enum": ["pinhole", "pinhole_radtan", "kannala_brandt", "double_sphere"],
                    "description": "Distortion model name. 'pinhole' = no distortion; 'pinhole_radtan' = Brown-Conrady (radial+tangential, diverges past ~180° FOV); 'kannala_brandt' = Kannala-Brandt fisheye (OpenCV, valid for ≥200° FOV); 'double_sphere' = Double Sphere (Usenko et al., valid for ≥200° FOV)."
                  },
                  "width": {
                    "type": "integer",
                    "minimum": 1,
                    "description": "Image width in pixels (e.g. 1920)."
                  },
                  "height": {
                    "type": "integer",
                    "minimum": 1,
                    "description": "Image height in pixels (e.g. 1200)."
                  },
                  "fx": {
                    "type": "number",
                    "exclusiveMinimum": 0,
                    "description": "Focal length in pixels (x-axis)."
                  },
                  "fy": {
                    "type": "number",
                    "exclusiveMinimum": 0,
                    "description": "Focal length in pixels (y-axis)."
                  },
                  "cx": {
                    "type": "number",
                    "description": "Principal point x-coordinate in pixels."
                  },
                  "cy": {
                    "type": "number",
                    "description": "Principal point y-coordinate in pixels."
                  },
                  "distortion": {
                    "type": "array",
                    "items": { "type": "number" },
                    "description": "Distortion coefficient vector. Length and meaning depend on model: pinhole_radtan uses [k1,k2,p1,p2,k3] (3-5 elements), kannala_brandt uses [k1,k2,k3,k4] (4 elements), double_sphere uses [xi,alpha,k1,k2,k3,k4] (6 elements). Optional: pinhole model has no distortion."
                  }
                },
                "required": ["model", "width", "height", "fx", "fy", "cx", "cy"]
              }
            },
            "required": ["name", "resolution"]
          }
        },
        "gripper_capture": {
          "type": "object",
          "description": "How the gripper channel is sampled during capture.",
          "properties": {
            "mode": {
              "type": "string",
              "enum": ["continuous", "binary", "none"],
              "description": "'continuous' = analog stroke, 'binary' = open/close switch, 'none' = no gripper."
            },
            "normalized_range": {
              "type": "array",
              "items": { "type": "number" },
              "minItems": 2,
              "maxItems": 2,
              "description": "Normalized capture range, conventionally [0.0, 1.0] (0 = open, 1 = closed). Physical stroke lives in gripper_range."
            }
          },
          "required": ["mode"]
        },
        "demonstration_modes": {
          "type": "array",
          "description": "Teaching modes this embodiment supports; consumers switch capture UI accordingly.",
          "items": {
            "type": "string",
            "enum": ["kinesthetic", "leader_follower", "teleop_only"]
          },
          "minItems": 1
        },
        "calibration": {
          "type": "object",
          "description": "Calibration requirements for a valid capture session.",
          "properties": {
            "hand_eye_required": {
              "type": "boolean",
              "description": "Whether hand-eye (camera↔arm extrinsic) calibration is required before capture."
            }
          },
          "required": ["hand_eye_required"]
        }
      }
    },
    "capture_profiles": {
      "type": "array",
      "description": "Optional (additive, v0.5+) named capture presets. A registry entry may carry several; a consumer selects one by name to configure a recording session (task, frame rate, camera subset, annotation template).",
      "items": {
        "type": "object",
        "properties": {
          "name": {
            "type": "string",
            "description": "Preset identifier, unique within this embodiment (e.g. 'tabletop_pick_place_v1')."
          },
          "task": {
            "type": "string",
            "description": "Human-readable task this preset targets (e.g. 'tabletop pick-and-place')."
          },
          "fps": {
            "type": "number",
            "exclusiveMinimum": 0,
            "description": "Recording frame rate for this preset."
          },
          "cameras": {
            "type": "array",
            "items": { "type": "string" },
            "description": "Camera keys used by this preset (subset of capture.cameras names)."
          },
          "annotation_template": {
            "type": "string",
            "description": "Annotation taxonomy/template id (e.g. 'manipulation_v1', referencing taxonomies/manipulation_v1.json)."
          }
        },
        "required": ["name"]
      }
    }
  },
  "required": ["id", "display_name", "arms", "dof_per_arm", "joint_names", "joint_limits", "gripper_range", "base_frame", "assets", "teleop"]
}